{
  "run_id": "e2e-observe_parallel_full_path-20260804T042828Z-3080043",
  "scenario": "observe_parallel_full_path",
  "pass": false,
  "stages_verified": [
    {
      "stage": "bootstrap_catalog_approved",
      "pass": false,
      "detail": "aid-test-catalog-approve.sh failed: aid-test-catalog-approve.sh: --proposed '/tmp/tmp.mc709E8gPo/test-catalog.proposed.yaml' failed schema validation before approval — refusing to publish an unvalidated catalog"
    }
  ],
  "commit_sha": "00a131ba55e0321319d36032f94642f846897294",
  "evaluated_at": "2026-08-04T04:28:28Z"
}
