{
  "run_id": "e2e-self_host_bundle_refresh-20260804T042829Z-3080043",
  "scenario": "self_host_bundle_refresh",
  "pass": false,
  "stages_verified": [
    {
      "stage": "quarantine_remediation_bundle_regenerated",
      "pass": false,
      "detail": "collector's current real result (expected until the deferred real divergence campaign runs): TEST: run_units_expected is re-derived live from the current catalog, never hardcoded\n  PASS: run_units_expected=83 (live from /opt/eco/projects/aid-orchestrator/.aid-o/config/test-catalog.yaml)\nTEST: a qualifying divergence-evidence artifact exists for the CURRENT commit, covering the FULL current catalog\n  FAIL: no qualifying divergence-evidence artifact found under /opt/eco/projects/aid-orchestrator/.aid-o/work/evidence/scheduler-divergence for commit 462a43fde24ae67386839f7e99fa3abc89ec8f7c, mode observe_parallel, covering all 83 current run_units — run aid-test-schedule-divergence-check.sh first (this script is a collector, not the measurement itself)\nResults: 1/2 passed, 1 failed"
    }
  ],
  "commit_sha": "462a43fde24ae67386839f7e99fa3abc89ec8f7c",
  "evaluated_at": "2026-08-04T04:28:29Z"
}
