{
  "run_id": "e2e-sequential_regression-20260802T115515Z-117389",
  "scenario": "sequential_regression",
  "pass": true,
  "stages_verified": [
    {
      "stage": "bootstrap_catalog_approved",
      "pass": true
    },
    {
      "stage": "bootstrap_mapping_confirmed",
      "pass": true
    },
    {
      "stage": "execution_yaml_generated_with_targeted_tests_gate",
      "pass": true
    },
    {
      "stage": "sequential_mode_targeted_tests_passes_unchanged",
      "pass": true
    },
    {
      "stage": "sequential_mode_never_writes_emit_units_artifact",
      "pass": true
    }
  ],
  "commit_sha": "931ba163701c7ca79c4aeb83f14c825eccaa3ef2",
  "evaluated_at": "2026-08-02T11:55:15Z"
}
