{
  "run_id": "e2e-observe_parallel_full_path-20260803T202438Z-3414299",
  "scenario": "observe_parallel_full_path",
  "pass": false,
  "stages_verified": [
    {
      "stage": "bootstrap_catalog_approved",
      "pass": false,
      "detail": "aid-test-catalog-approve.sh failed: aid-test-catalog-approve.sh: --proposed '/tmp/tmp.r5iALWXjoC/test-catalog.proposed.yaml' failed schema validation before approval — refusing to publish an unvalidated catalog"
    }
  ],
  "commit_sha": "6b6cfaa5fda36dbf9bdf4248cc48e35bb72d7c5b",
  "evaluated_at": "2026-08-03T20:24:38Z"
}
