{
  "run_id": "e2e-observe_parallel_full_path-20260803T223225Z-432541",
  "scenario": "observe_parallel_full_path",
  "pass": false,
  "stages_verified": [
    {
      "stage": "bootstrap_catalog_approved",
      "pass": false,
      "detail": "aid-test-catalog-approve.sh failed: aid-test-catalog-approve.sh: --proposed '/tmp/tmp.0Qm7yjFNLo/test-catalog.proposed.yaml' failed schema validation before approval — refusing to publish an unvalidated catalog"
    }
  ],
  "commit_sha": "17290f7b61cedbc492c1b9d35649f4ecf371b6b9",
  "evaluated_at": "2026-08-03T22:32:25Z"
}
